{"configuration_digest":"aaaaaaaaaaaaaaaaaaaaaaaaaaaaaaaaaaaaaaaaaaaaaaaaaaaaaaaaaaaaaaaa","decision":"approved","decision_id":"00000000-0000-4000-8000-000000000021","intent_id":"00000000-0000-4000-8000-000000000001","mapping_age_ns":1,"market_age_ns":2,"rule_set_version":"risk-v1","rules_checked":[{"before_value":0,"limit_value":130,"outcome":"pass","projected_value":65,"rule":"mapping","unit":"units"}],"schema_version":"1.0.0","session_state":"ready","timestamp_ns":100}
